review_text,label
Best magazine. I love the recipes.,5
This a nice colorful magazine loaded with great ideas.,4
One of my Mom's favorite for years...,5
Never fully loaded. I found this was a major glitch on their free issues.,1
Love this magazine...only one of two that I read cover to cover.,5
Not really what I am looking for. Slick magazine but not for me.,3
"had seen the magazine inthe doctors office, So decided to order,. Very pleased. Liked the craft info thats in them",4
My wife loves this.,5
To me its not the magazine it used to be. I now quite often find it very confusing.,2
It is hard to move around within the magazine.  Difficult to read because of the very small print on my Kindle Fire.  Because of the format I can't increase the size of the print.,1
Nice layout; easy for little ones to go through. A few more pages would be welcomed.,4
Great Mag.,4
Some good recipes but really seems like every other page is an advertisement as the time goes on.,3
Too many ads not enough articles.,2
I didn't like all the advertising.  Not enough recipes. Not worth the money.,2
"This is a great magazine. I have subscribed to it for as long as I can remember. It is full of great advice, new product information, etc. I love it and HIGHLY recommend it!!",5
Awesome articles and pictures. I love ready from this magazine and learning from this source.,5
I have received this magazine for many years and it helps me set up the DVR for the week. I circle the programs that I am going to program.,4
Wonderful for keeping up to date and finding new products and ways to use them,5
"As always, this magazine exceeds my exectations.  I learn valuable new tips with every issue.
Sharon Weeks",5
I made a mistake. i meant 5 stars. i appreciate access to book reviews of books wjich ordinaroly would not be found in bookstores where i live.,1
Great Magazine has lots of information that will us go self-sufficient.,5
Absolutely love this magazine!,5
"Never a problem with issues, when I renew through Amazon for the past three [3] years.  Highly recommend magazine renewals.",5
"Son liked this publication, but it's now too expensive",3
"For those with country decorating in mind, for sure.",3
Excellent daily devotional and aid in preparing for Mass. Also wonderful articles and Saint biographies.,5
"I used to like your articles. Now seems too much hi priced fashion, too little reality, in this needy world.",2
I don't like auto renewal. I never order your magazines because of it. Wish you got rid of auto renewal.,1
Great information on investing!,4
My favorite magazine at an all time amazing price!! Thank you Amazon!,5
Fun read.,4
Not good at all.,1
"I renewed a subscription for someone on your ""renew site"" and now the magazine comes to me instead of the gift recipient.  Not good.",1
One of my all-time favorite magazines! Great value.,5
"waste of paper, etc. stick to online content. this magazine's primary purpose is to advertise paints.",1
This is a good magazine. They have redone the inside since the last time I read it. The format is much better now.,3
This subscription was for my son. He enjoys the Sports Illustrated magazine. This makes a great gift for teenage boys.,4
Love every issue. Can't be without. Look forward every week to the interesting stories.,5
Daughter loves the magazine. Lots of coupons. Lots of great recipes. Absolutely the best magazine I've had in a long time. A bit pricey.,5
I feel short changed. I don't feel like I'm getting the value of the subscription in the content of the digest. Would not re-order.,1
"Horrible, It was nothing but ads. I am not impressed at all.",1
"I love, love, love, this magazine!!",5
"I liked it so well I ordered the DVDs set of every issue of Handloader ever published from Wolfe publishing. If you hand load, this magazine is a must for you.",5
How can I review this when I haven't got it yet? I will never buy a magazine subscription from Amazon again. Almost 2 months and I haven't received anything yet!,1
Magazine is great but the emails are a nuisance. Once subscribed it seems there are lots of offers for stuff.,3
Not as dynamic as I was hoping.,3
Magazine is quite small.  Not a lot of articles anymore.  A lot of ads.  Probably won't get it again.,3
I am 72 years old. I don't feel the same about the magazine as I did when I was a teenager. But I think that is normal.....I hope.,3
"In my opinion, it doesn't have alot of content and might as well subscribe to their facebook page and get it there for free",3
"I used to love PM, but these days its like a hollow shell of its previous form.",2
"I love this magazine...it has everything that I'm into:  The styles, the looks, the makeup, the celebs and more.. Great magazine..it's worth the money!!",5
"We have read Historia y Vida since the '70s and it has always kept it's high standards,it is the best historical reading ever.",5
Great magazine!  Arrived promptly!,5
I'm not sure that this magazine is what I remembered.  It seems more family oriented and even my granchildren are grown now.,3
My favorite magazine for women over 40. Price was good too.,4
"I got my first digital last week. I really like it, but I am waiting for the magazine to start.",3
"terrible.  bought a subscription for my mother, last december, and as of today, 7-16-15, she has only received two books.  I would not recommend this subscription to anyone.",1
Enjoy reading it very much. Have been reading it for several years.,4
Some issues are full of great projects and some are real stinkers.  Guess opinions vary.,3
Great magazine! Wonderful articles and home town life.,5
"Small fold out, only a couple pages. Was looking for something a little bigger and solid for my 6 year old. This is like something you get at a restaurant.",3
"not deep enough on the ""technical"" side.",2
"Love it, and you cannot beat the price.",5
when i actually get the magazine/.,3
"Takes a few months for delivery, but always liked the magazine.",4
"This order was done quickly and great quality, highly recommended.",5
Eh. Just fallow their Facebook page. It's the same articles but free.,3
"received 3 issues and then none, zero, nada.",1
I like the running tips .  It is published bi-monthly.,4
Absolutely my favorite magazine!!,5
I like the star and reading it on my phone,4
This was a great price for this treat. I enjoy it immensely.,5
Husband loves this,5
My daughter love's it,5
"I cannot read the magazine. The zoom function does not work as in another magazines. I hope they will fix it soon. if not, i will not renew my subscription.",1
Not pleased only received one magazine since July,1
great buy on an essential magazine for TV viewing.  I will auto-renew every year through Amazon.  Husband and I share it.,5
Love these!,5
Each issue seems to have a limited scope - one or few topics or people - if you're not into that topic or person then pretty much the whole issue is a bust.,2
"Love this magazine , all about coastal decorating and beautiful places to see. Definitely a great magazine to purchase",5
I can't find this magazine on my kindle,1
My only complaint is constantly getting renewal messages in the mail. I received one even before getting the first issue.,4
"I really don't care for the humor, though I support their right to express their views.",4
"Not as good as it used to be, but okay.",3
I have not received the magazine yet!! It was paid on September. 14th!!! Not happy!! It is now October 18th!!!!,1
I did not order this.  I have no idea how rhis happened,1
I've always liked this magazine,4
"I like the good housekeeping magazine, the
price was unbeatable, and the subscrption
was started very fast.",4
"Gone 21st century and that isn't an improvement in my book.  Used to love this mag, but highly disappointed in its current state.",2
It said I would be getting 8 issues. I got 4. Do not subscribe to this. Its not worth it.,1
Good pictures and recipes but way to much advertising.,3
The rest of the magazine leaves a lot to be desired.  Not too much interesting stuff.  It is poorly written and not interesting.,2
This mag is a total waste of paper. One month is just a copy of the previous month with a different cover,1
"Nice magazine, of course, but the view i can get through the kindle pprwhite is definitely bad. Not recommended for this kindle.",2
Not really keeping up with the times in a young girls life...at least not here in the urban areas.  Need to address current life more,3
I find that this magazine is too full of advertising and not enough of the guitar lessons material I was looking for.  I won't re-subscribe.,2
Maxim has gone downhill over the years.  More of a yuppie mag now than appealing to the average Joe.,3
NO BOOBS !! articles are still ok!,3
I was very disappointed this is strictly a trials magazine full of ads.  No real rabbit hunting.  I would not buy,1
Great price through Amazon!  Love Food Network magazine!,5
"Did not like the magazine. Too outrageous. Plus, they tried to charge me more than the initial subscription fee 3 months later.",1
i would rather buy hustler then pudhouse,1
It has been well past when my order should have arrived with no luck,1
So much more advertising than actual articles.  I was hoping with the advertising they would list already existing log homes for sale.,2
Probably the least well written of all the hunting and fishing magazines on the market.,2
"This is one of the worse magazines I have picked up in years.  If you have ""money to burn"" traveling, then it might be for you.  Loaded with advertising and little 'true' content.",1
I've always liked this magazine.  I am not a fantastic knitter but like to dream about projects as I enjoy magazine.,4
I renewed this magazine for my daughter.  She loves all the fashion magazines and the price on this couldn't be beat (2 years for $7.00),5
every kids loves,5
Great magazine. As always I am able to travel many places and learn so much more of the world.....just by sitting and reading. The photography has always amazed me.,5
Once upon a time WIRED wrote articles that focused on technology. The End.,1
Not impressed at all; tote set was thin and very cheaply made,1
Unbeatable price for fantastic content. Really love the broad range of innovative science they cover. I would give one to any niece or nephew.,5
A good source of young mind info,4
Never was able to access,1
"Since I have a windows tablet, I have no access to magazines, even though I have been a prime member for several years. Makes me want to cancel my prime membership.",1
I don't feel the articles are as good as they used to be....but.....then...i don't always look at this for the articles.,3
"This is the first time I have used the ""Electronic"" Edition of the publication...it's great!  And the content is as it always has been...thought provoking and inspiring.",5
"So nice to have this to read, and cheaper than subscription and Newstand.",5
Got it for the office reception room.  Women did pick them up and browsed them.  No substance.  Lots of pics.,3
"""Men"" magazines are now targeting ""women""?  Not for me!  Cancel please.",1
Not very interesting.,2
No recipes I wanted in the first issue,1
Sent as a gift to grandson and son. They look forward to every edition!  Happy with the choice I made.,5
if you are a very serious fisherman like i am.this is the magazine for you ever since i bought this magazine.i have learned so much tricks.to make me a better fisherman,5
Was not able to download to any of my five devices?,1
My daughter has not started receiving the magazine. When will she start getting it. I ordered it in December.  ?????,1
Sister loves loves loves loves LOVES it!,5
Wired is not an easy app to use; the articles are difficult to get into ; app is not intuitive,1
some interesting stuff.,4
Beware you won't receive your first issue for over 45 days of placing the order.,1
"There is no better magazine than Good Housekeeping.  The stories are great, the recipes are wonderful and the articles are the best.",5
ITS CALLED SPIN TO WIN RODEO BUT IT ISN'T ABOUT THE RODEO,1
I have always liked House Beautiful. I got it for a good price so was really happy with this purchase.,4
Just another cookbook magazine.  Recipes are a little hard to follow.,3
If a 5 month subscription is $114 then each magazine would be $22. I think savings listed is false advertising.,1
"I have been looking for a daily meditation and daily prayers. This is exactly what I have been wanting and needing, so glad to have found it!",5
"It was easy to do, but I wish an acknowledgment would be sent by the company which receives it in the end.",3
I have not received any issues yet.  I would like to know when I will get my first issue.  I've seen new ones on the newstand since I paid for my subscription.,1
Better than most other similar magazines. Easy reading. Perhaps a bit simplistic for experienced handymen who already know many of the tips offered.,4
"Excellent! Informative, insightful and useful",5
"SOme months lots of good ideas, some months now to many. Still like it though.",4
My 9 year old says it's the best magazine ever and looks forward to it every month. I think it's a great way to encourage literacy.,5
i ordered this and have not heard anything from the company or see any thing in the mail. Not to happy about it at the moment.,1
The other reviewer was right. It's a bait and switch. I cannot download on my Kindle.  What crooks!,1
"mot for me, just coin prices, not to much about coins",3
Awesome magazine!  Loaded with great articles and useful tips. I look forward to getting the magazine in the mail each week.,5
"I really love this magazine because it has parenting articiles in it!

Every parent should read this magazine!  Really good activites and advice.",5
"I would love to be able to rate this subscription, but I have yet to receive my first issue.
Can you tell me when I can expect it?

Thank you",1
Just tells stats,3
Loved the Billy Goat story. Thanks for all the inside PCT notes.,5
"On my Kindle Paperwhite, Time is not in color and there is not a complete edition of the magazine. I won't be paying for a subscription.",1
I really enjoy this digital copy of the Word Among Us. I use it daily.,5
It is a little bit too eclectic for me.  I probably will not renew.,3
Tired of depressing news all the time?  Then this is for you.  Fresh new ideas and inventions.  I love it.  Something positive about our future.,5
too much advertisement..but they do put good information an tips,3
My 3 year old granddaughter loves this magazine!  It was a great gift!,5
I purchased this magazine and I can not get it to show up in my kindle?  What good does it do to buy print & Kindle when you can not use it?,1
I cancelled the sub. Text way too small for a 8 in tablet.,1
We have been receiving this magazine for over a year now and we always look forward to it! So many great ideas and how tos!!,5
"An unfortunate title considering the indigenous people of this continent, or ""Indians"", have been almost wiped out by invading Europeans. It's pretty much just Cowboys now.",1
Great magazine at a great cost through Amazon.,5
"got this mag 4 my daughter,she loves it.lots of articles and pics of the ""hot"" people of 2day.",5
Okay Magazine. But because I am no longer a Prime Member it's no longer free.,3
This magazine is a Christmas present to a relative.  He enjoys it very much.  I have had issues with the publishers about duplicates but that seems to have been straightened out.,4
Of course Mad Magazine is a great subscription. But it took four months to get our first issue.,4
Can do without the sexual covers but this magazine is filled with great information,4
Advertisements overflow,1
ok magazine,3
my wifes favorite magazine. Very modern.,5
if you are wanting to start investing on your own (away from an advisor) this is a fantastic place to start.  they have well writen articles and great information.,5
I have enjoyed this magazine for many years and still think it's the best for what I do.,5
"I love tea,and blending fruits and teas and other herbs together. This magazine is awesome!",5
"I haven't received magazine yet or any notification as to when I will get it
It would be nice to know when i can stop buying it in store",1
I am waiting for the next issue before I grade it again.  This one was a little different than is my style of cooking.,3
Fantastic product!,5
"Great coverage of current events, I look forward to reading it weekly.",4
only recieved one issue,1
"Just received two issues then stopped receiving, my courier told me i hadnt received any further issues, tried contacting but all i got was that all issues were sent...awful",1
This month's (Sep issue) Kindle Road & Track has been  supplanted by an issue of Seventeen magazine.,1
Nothing useful in this journal.,1
My daughter is 4 and loves this magazine. We read it over and over and over!,5
"I did not agree to auto renewal, and when made aware of the gimmick, it was very difficult to undo.  Dumb policy and bad process.",1
About half the mag was articles. If I wanted to view ads I would turn off my ad blocker. I cancelled after 2 months.,2
"I love it on my iPad, and I also receive the paper copy for my husband.
All for one great price.",5
Love it well worth the monthly investment. Now I just sit back and wait for mail,5
"Magazine is good, however Kindle support is very poor. God help you if you have to call Amazon.",1
"I purchased the magazine on december 24 and I didn't get any issue yet, what can I do about it?",1
Wanted to like it but I Cannot read it on my Kindle app on Surface Pro 4.. Come on Amazon lets fix this..:(,1
"I ordered and paid for a 12 month subscription back in May, 2009! It is now July 19th and so far not one issue. Wow!!!!",1
Very nice magazine...,4
Ordered for my husband and he loves it!,5
Anyone interested in how the mind works can't help but be fascinated by nearly every article in each issue.,4
A great magazine for dog lovers,5
I guess they ran out of credible sources things to write about so no need to buy it now.  Seriously - The Food Babe???????  Who is the editor for this ragazine,1
"good articles and clear instructions.  Tends to not have the ""here's what I've done and I recommend it"" type articles as much as the ""muscle"" type mags.",4
I would like more articles on the Food Network programs and personnel and fewer recipes.  I can get all the recipes I want on Epicurious.com or other sites.,3
"Didn't order it, just called to have it stopped. Looked at it and not interested.",1
I love the magazine - I hate that I can't tap it and make it a readers page. The page can only be magnified.,3
Suddenly the content moved from Centris to Left / Progressive and from unbiased truthful reporting to biased propaganda.  I canceled.,1
Too much adverting and little content,2
I do not wish to subscribe to this magazine.,1
In depth news on today's topics,4
I got a 3 yr subscription for $12!!!!!  This magazine has such awesome ideas & articles! I love it! A parent must have!,5
I bought this subscription for my son who is thinking of starting a business.  This is the most thought provoking magazine in this category,5
wish I hadn't subscribed to it.,4
"This was a great Magazine when  a couple years ago.  Now the coupons are practically worthless and when the subscription expires, it won't be renewed.",3
A great magazine to read and study with a good variety of  subject fields but a little too heavy on the green agenda. For the most part very intriguing,4
Maybe I just picked the wrong month to give it a try.  Seemed to be all about politics.,3
"Nice magazine, good photos.",4
"A gift to my son, this one he wanted, I selected a few more for him, which he enjoyed greatly",4
"Typical Conde Nast publication, pretentious and superficial but fun to read.",3
I use this mag for design ideas for my home.  It's perfect for my needs.,5
it's  a cheap magazine  ... and my dad likes to fish but it has way way way too many ads,3
My husband says it's not as good articles as they used to.  I won't be renewing it for him.,3
Nine year old granddaughter loves this magazine!,5
Love readers digest. The perfect mix of humor and information.,5
Why have I not rec'd this product?  When will I rec this item.  This is a great magazine but what happened?????,1
Not a great magazine.  There are other food magazines which are better.,2
it has diversity .offers online view of galleries that are featured i recommend it for anyone that likes art or wants t keep up on it,4
"Love the magazine, but still have not received any!",3
Always love this magazine.  Dreams unlimited.,5
This is my third year reading this magazine and I love it. Great reviews. A Must have for todays hand gunner!,5
My brother is the big Steelers fan and he enjoys this a lot.,5
My favorite magazine.  Lots of info on many different areas of everyday living.,5
Just what my daughter wanted!(She's a big Robb James Collier fan!) Thanks for getting it to me so quickly.,5
DISAPPOINTED,2
It was mostly ads and it was a huge disappointment.,1
would def subscribe if this was available as a monthly issue.  not diving into 25.00 bucks without experiencing it first.  SB,1
"I mean... it has some good recipies, but its pretty boring. I won't subscribe again :-( Id rather watch her show :-)",3
A whole bunch of commercials and a couple articles and even less pictures worth looking at.,2
"I've always bought this magazine on the newsstand. It's informative,funny and responsible. Now I'll never miss an issue.",5
Too many ads. Just a few articles.,3
Not what i was wanting.  Assumed there would be more recipes.,2
Wish they wouldnt always put skinny people on the cover show real women we are all sizes even plus size and we workout too,1
Best way to follow daily mass with devotional at the end.  Love it!,5
Used to buy this magazine years ago and loved all the tips. Unfortunately now instead of a lot of great ideas it is mostly advertisements.,2
Takes a llllloooonnnngggg time to load. Ridiculously long.,1
Slowly evolved over the years to a slick vehicle of advertisements with a few articles sandwiched between. Sad.,2
pretty much what is on the website. there are a few more in depth things. lots of easy recipes.,3
Best magazine I found so far.,5
I love this and the price. Great information that pays for itself.,5
It was a good test subscription for the promotional price. The magazine contains a lot of advertisements. I wish it contains more and newer articles.,4
repetitive if you have received it for a long time!,3
Am a long time reader. Home Theater is a great publication. Just not sure why the magazine isn't supported on Kindle of Android...,3
Reptiles Magazine is hands-down the best monthly reptile publication. And Amazon has the best price! Win-win!,5
Have always loved this magazine.,5
"Informative, colorful and a great read.",4
"Really enjoying this magazine
Great landscaping ideas ,decorating and recipes",4
The first words in the lines of the articles were cut off. Frustrating.,2
"I wanted to give a gift subscription of PS to my grandson but have changed my mind due to the sexual content of many of its advertisements. Shame on you, PS!",1
never received digitals guides,1
Great way to discover new writers.,4
"I ordered this magazine for my 7 years old boys. It was a mistake. There are so many ads inside that it's hard to find any article.
I would not recommend this magazine.",1
What's NOT to like about this read? Love the recipes too!,5
They will slam you with an unwanted subscription.,1
Love it. Arrived fast. Great deal.,5
Not like what it was when i was a kid,3
I love this magazine!  Thank you!,5
"Don't know what happened or who to call, going on 7 weeks and still no magazine.",1
The Economist magazine needs to hire a good economist who can advice them on how to set a proper price for the Kindle version of the magazine.,1
So expensive.just buy don't build,1
"I can not answer untill I start reciving an Issue
I am still waiting on my first issue, it is hard to judge untill I get my first Issue",1
"Amazon must think we are fools. It's $4 cheaper directly from Stewart's website.

On the other hand, there appear to be a lot of fools here.",1
"Problem is with the hard copy that is perfumed, causing allergic reaction.  I do not buy magazines with perfume inserts.",1
"The digital portion does not work on my kindle oasis, the reason for the 1 star.",1
Saw the next issue on news stand and it was full of ads compared to the one I had read.  So I cancelled it.,1
Received my first issue. Like it thus far.,4
Don't waste your time unless you have a kindle fire or ipad.  Kindle apps on android phones or tablets are not allowed to load this kindle item.,1
Less than 6 issues for 1 year subscription.,1
"I received the first copy in less than 2 weeks, much earlier than expected! Love it!",5
Fantastic recipes in every issue + tips and tricks to make cooking and baking FUN!,5
"Never get the bag, as magazine not to bad",1
Best price.,5
I have been reading this for years and enjoy the reviews.,4
"I have this magazine because it teaches me new things each issue. I like the trendy patterns but usually tone them down, alter them to be less flashy.",4
great! was easy to load and loved the ease of readi g this. will definately get again! nice and colleges,5
I am little too old for this magazine,3
It met my expectations,4
It's awesome my fiance' loves it,5
"my daughter really like this magazine enjoys reading the articals and finding new trends and the great information ,we highley recomend it",4
Too much advertising and just too much stuff.,2
