review_text,label
Great recipes that include basic nutritional data so you can easily decide if a dish is right for you. Easy to navigate on Kindle Fire. Tablet bonuses are great.,4
I did like this magazine but each one was pretty much the same and offered little variety.  I guess that's how it is with magazines these days though.,3
I ordered this May 8 and have still not received a copy nor any acknowledgement of the order except from Amazon.,1
"I love this magazine. It is filled with savings, recipes and great ideas. I bought it for a great price",5
Not impressed... cancelled,1
Not enough DIY projects to rate higher.,2
"Not that good, but still good.",3
"If you're a history buff, you have to try M.H.. Twice a month, means a lot of tropics can be covered.",3
This magazine is full of AMAZING recipes with mouth-watering photos to go along with. Especially love the articles on wine that give great tips for the wannabe wine connoisseur!,5
Love this magazine.  I'm a big time home improvement nut and I continually find myself finding valuable tips in each and every issue.,5
"TV Guide continues to diminish the number of channels listed in its TV schedules. Almost worthless to me now.
More and more infomercials on TV shows.",2
I have been reading World Magazine for a while now. Glad to be able to get a digital version for my Kindle app on my Android device. Wonderful magazine that is well written.,5
Clear writing and thoughtful articles - great reading for anyone interested in contemporary Catholic thinking!,4
LOVE IT from cover to cover!,5
I ordered this magazine and did not receive one single issue.,1
inexpensive ideas with lots of good ideas and recipes,4
Alot of ads in.magazine,2
I love my Bookmarks magazine.  It helps me decide which books I choose to buy.  It gives you reviews from multiple sources.,5
"I subscribed it in March, 2012. Yet to receive first issue. what a waste!!! I do not have anything else to write.",1
"great magazine. my bro loves the articles and the gift. He spends all the time he can in the woods, so this is the perfect magazine for him. yeah!",5
I've never understood why a weekly subscription takes 6-8 weeks to get started. Just doesn't make sense.,1
I've read similar issue articles in other publications.  Very disappointed that writer's opinion is forefront and central to the articles throughout the magazine.,2
my husband loves it.,5
I cancelled the subscripton before it began because i found another offer at half the price.,1
they haven't gotten it yet and it was a gift???? I don't know what the hold up is and I'm getting the run around.,1
"A good science mag, but not really break through. I like popular science better. And popular mechanics better too. .",3
Love TV Guide,5
"If you are interested in advertising and reading about artists interviews, then this is the magazine for you.  If, however, you want insight into methods and how to's forget it.",1
Best magazine for boys,5
Wonderful and wise way to make the right choices in an infinite cultural space of talented writers.,5
Just wanted halloween recipes not very many,2
The word among us is the best catholic tool I ever read.,5
"Not too much to review. She lives the magazine, so why not get her the subscription? Only reason it's not 5 stars is because it doesn't ship with apple pie.",1
Really enjoyed this magazine & especially all the great ideas.,4
"The only thing I could download was the cover. I tried over and over to download more, but it was a fruitless and frustrating experience.",1
Just wasn't too impressed with this months copy. Want to see what the next few months are like to see if I will renew next year.,3
Not quite the magazine it used to be but still very informative,4
"I WAS EXPECTING A MAGAZINE ABOUT CRUISING, INSTEAD I FOUND THAT IT WAS ABOUT SERVICES FOR CRUISE COMPANYS WITH LITTLE TO INTEREST THE AVERAGE CRUISER.",3
I don't like the auto renew.,1
A poor substitute for the image-laden actual magazine.,1
I was looking for ideas for my own home not other homes in this magazine. I live in a rural area and would like to find items for that kind of area.,1
boring magazine but something to read on vacation,3
to many adds  will cancel don't care for it,1
"Bought for my wife, she likes it ""okay""",3
"Wonderfully varied, well-written articles. If history is your ""thing"" , this magazine is a perfect fit.",5
This is an excellent magazine and I look forward to it each month. I particularly enjoy the variety of articles on things that are relevant to current society.,5
The best magazine for up and coming filmmakers. Nobody rivals them.,5
My husband loves this magazine! He is always looking forward to the next issue. I recommend this magazine to everyone who loves trucks / jeeps.,5
Wished I'd known it was only six issues a year. Better coverage and reading in Pop Photo. Or Petersen's. Or the newspaper.,3
Wonderful magazine!!,5
"OK, but the older PM was much better.",3
Way too much advertising and most content was not of interest to me.,2
"I just love this magazine!!
Great Coupons, helpful cleaning/organizing tips & great recipes!!
This is one of the good ones out there!",5
I bought this subscription for my mom for her birthday and she loved it.  She read the first issue and can't wait for the next one to arrive.  Thank you.,5
The magazine never appeared on my kindle.,1
I just started reading this publication.  It is very interesting.  I like it and I don't usually like these type of writing.,4
Only received one issue,1
"This is great if you are looking for high-end professional tailoring and fashion info.
For the hobby sewists, not so much.",3
My favorite magazine.  I love the convenience of ordering my magazines on Amazon!,5
"I can't live without The New Yorker. If I read nothing else in a given week, I read The New Yorker. I love the variety of topics, the comics, the stories, and the movie reviews.",5
"Magazine not what I thought it would be, nor should be. Cannot be easily read  on the Fire. Better luck next time.",1
Thanks for offering such a great deal. I couldn't pass this up. If and when I am close to the end of this subscription I hope I can get this deal again.,5
Way too many ads.  Made it difficult to find articles.  Super heady cologne ads for men's fragrances stayed on hands and clothes.  Found one good article.,2
I love this magazine !,5
Not up to par,1
"Ordered the magazine in August and was told it would not start until December, it better be worth the wait, will not renew script, birthday gift turned Christmas gift.",1
"Magazine is good as always although it appears to have shrunk considerably, however I never received the bag",4
The only thing I was unhappy about with regard to this order is that I was not able to cancel it - I made this particular order in error.,1
A good read for the outdoors-man.  I wish they had more articles covering western mule deer and elk.,4
"This is the best of the outdoor fishing magazines. Usually has interesting research in the front pages.

Good graphics, many species covered.",4
Way too many ads for stuff I really don't care for.  Not enough articles or western US interest material,2
Cancelled. Did not have type of content and interest I recalled from long-term subscription from years ago.,1
This magazine is the best on the market.  Great demos and information for all artists of all mediums.  I would highly recommend it.  You won't be disappointed.,5
"I like most of the decorating articles, real people doing real things to their homes.  The rest of the magazine is okay.",3
we have subscribed to this mag for lots of years. my son loves it. lots of interesting articles for our aspiring engineer.,5
But the price is nuts! At least with the print version I can clip articles pass it along and take to my library when I am done.,3
I was not able to open it up on my Kindle. The only articles that came through were the ad pages?,1
Mostly ads and some bad some good poems to read. Found many poems inaccessible. More like a pulisher's ad sheet than a review of poetry.,3
Not happy with the publication,2
It's been over a month since I paid for the subscription and I still haven't seen any sign of a magazine yet.  <sigh>,1
Practically all ads,2
"I love this magazine. It has so much information in it, and it's great to see the work others are doing.",5
"I didn't order this. I didn't ask for renewal. I tried to make it stop, but cant.",1
Not enough content. Don't want to let me stop subscription.  Would not buy it again!,1
Tried to cancel,1
I really enjoy the magazine.  My only thing is I enjoy reading on my tablet but for this magazine I can't adjust the type so it makes it hard to read.,4
A quick easy pattern source with the newest styles. I can always count on this magazine for easy gifts and stash busters.,4
There were at least 2 months that the magazine did not down load to my kindle. When I cancelled the magazine all of the magazines disappeared off my kindle. Very disappointed.,1
"We love this magazine. It has great DIY ideas, decorating ideas and othe ways to save money and make your home your castle.",5
"I didn't like this because I was wanting the subscription for my kindle paper white, or at least for it to accessible web-based and it was not.",2
"Meh, I'll just pick it up at the store.",3
Very female centered.  Some articles for guys but few and far between.  I find their web page to be more informative to my practice.,3
"It's nice to have this on my kindle where I can look for ideas for eal time envy where. Whether I have y phone .kindle, or ipad",4
Almost all ads.  Waste of $.,1
"It accomplishes its mission to showcase great writers, one story at a time. Each writer is different, and One Story puts a spotlight on the best of the best.",5
I haven't read PM in a few years. Not as good as it use to be. I use to have better content.,3
Apex gives one a glimpse into the exceptional abilities of minds on Sci Fi and Fantasy.,4
Not a Christian magazine by my definition. It's gone down hill.,1
Mens Advertisement Journal,1
Great deal for a low price!,5
Historical one of the best reads for Women of Color and continues to be a best read,5
"Unfortunately, I can't really review the magazine because I still haven't received it. The date they said it would arrive passed 2 wks ago.",1
I love watching Food Network but I can't say that I like this magazine.  I have yet to find a recipe worth trying.  Some good information in it but a bit disappointed.,3
Absolutely love this knitting magazine! Such a nice variety of patterns and techniques.,5
"Not fancy for me, but price was right. Lots of ads but have found a few recipes to try",3
"My subscription to ""German Life"" may have been purchased on 10/31/07, but I have not seen a copy of the magazine as of this writing.",1
Wife likes it.,4
Was very disappointed with the magazine.  Had no information about any local programs. Will not order again.,1
Its okay but the price point to is high.....,3
really neat magazine when the central article is something that interests me,4
My Grandson loves this magazine.  He gets a new one and shares the old ones with his friends. He loves sports he is great in basketball .,5
Allure sent me 3 magazines in the space of a month in order to get rid of back issues. Very disappointed.,1
Enjoying the digest.  It is still the same.,4
Good for collages.,4
"Enjoyed some of the articles in Atlantic although not all we for me.
Not all articles were of interest to me. Well written.",3
I like the stores and pictures of the new knives.,4
Very disappointing no access to web and very misleading on the digital capabilities,1
My grandson loves mad magazine. He was very excited when he received this as a gift. He read it over and over.,5
"Putting a well know uneducated fear monger (Food Babe) on the cover and then claiming that everyone that was vocally opposed to it must have been paid to do so, yeah I think not.",1
"I bought the kindle subscription version, it sucks because of the extremely slow download speed. I will cancel it.",1
My husband didn't enjoy it.,3
my 11-year old son loves this magazine,5
"There are way too many ads, but I do like some of the articles and recipes. More coupons would be nice.",3
I'm yet to receive a magazine or a free clutch. Terrible.,1
"I like to red about movies, TV shows, and people who are in movies or TV show.",4
Love this mag,5
Why are the same people featured over and over again in these magazines? I'm tired of hearing of kim and her obvious plastic surgeries!,3
Great magazine dedicated to Corvettes of all years.  Well written articles and technically sound columns. I look forward to each issue.,5
when i  was received this was to much wet with snow i did not complain for tha magazines. Thanks,1
Love this Magazine. Highly recommend for entertainment!,5
Paid for it and couldn't download it. Not sure what to do. Customer service doesn't get back to me.,1
"I decided to test out the magazine with 4 issues for .99, then get charged. I only got 2 and it tried to charge me. No way.",1
Still has a lot of process food options - would like more non-process - organic ideas.,3
Love Dr. Oz magazine....but have not tried the digital as of yet....,3
Not as interesting as I thought it would be.,3
Still funny after all these years.,4
"Great Magazine
I love reading it on my kindle
I would suggest for anyone and everyone
Easy read on your kindle",5
A must have......,5
too paritisan. I don't need someone to persuade me. I can make up my own mind. I want both sides of an issue. I will give it another couple of weeks.,1
Playboy died,1
"I purchased a People Magazine through my Kindle Fire.  It would only load the first few pages.  I tarried several times, but was unable to receive any pat of the magazine.",1
The magazine has gone downhill in the last few years.,3
Have not been able to access anything. It's very complicated to get it to work. Was really looking forward to reading Wired but no such luck.,1
Excellent kids magazine.,5
Use these recipes a lot. Love them all super easy and delicious. Has lots of ideas for freezing and easy prep,5
"This magazine spreads dangerous, false, and unscientific information. It is deeply rooted in conspiracy theory and promotes food elitism.",1
My family loves the National Geographic magazine.,5
it's okay,3
I tried to download it to my kindle fire and it would not download I wish it would have said that it wasn't for kindle fire,1
A very good general weekly magazine covering a wide range of topics.  There's usually something in there for every one.,4
"Reader review: I love this magazine, it has quiz ideas, crafts posters and much more.",5
Had the article in it I wanted to read.,4
Hard to use and never loaded,1
"The subscription is for my disabled son who does not own a kindle, nor do I so the kindle portion of the subscription is not usable. But he loves the magazine.",3
Got this for my mom. She loves this magazine.,5
Lot's of ads Articles boring. Used to be my favorite. Read it in 5 mins and throw it away,2
good magazine!,4
Was hoping to get tuned into men's fashion but this just has a lot of stuff I'm not personally interested in.,2
"Love this magazine, good price.",5
"Never got the hat, the auto renew was kicking in for way more than it was worth.",1
I love this magazine! The stories and photos are good.,5
I will always purchase my magazine suscriptions from Amazon!  They are the best deal you can get anywhere!,5
"few recipes, some nice pictures, a lot of advertisements.",3
"Newsweek used to be a pretty good, balenced magazine. Now it's about 60% ads 30% pictures and 10% ""news"" that always seem to be written like an editorial. Don't recommend anymore.",3
"Well, I'd love to say I love it, but this subscription has not provided a single issue.",1
"I don't get any anything
Lires",1
I love this magazine.,5
"THIS IS THE BEST RC CAR MAG OUT THERE. IT'S BEEN AROUND FOR OVER 25 YEARS. IT HAS GREAT PIC'S, ARTICLES, HOW TO'S, AND NEW PRODUCT REVIEWS. ITS FOR EVERYONE FROM BEGINERS TO PROS!",5
So many advertisements. You are better off going on Pinterest than paying to have people sell you finished products in a DIY magazine.,2
Who doesn't love Cosmo???? Great read!,5
Signed up at a low rate but the auto renewal rate was a ripoff too high. Decided to cancel it.,1
This was for my son who builds cabinets. He really enjoys this magazine.,4
Best bike magazine I have every subscribed to.,5
This is a great magazine. I have shared articles and puzzles from it with my students.,5
"Love Southern Living! I've been a subscriber for years. Decorating ideas, and recipes the best!",5
The stories/reports are not especially deep. I was also looking for more historical artlcles. Much thinner than I rememember.,3
my favorite magazine!,5
Wonderful recipes in this publication.,5
"who's seriosly going to pay more to get less.  Love the magazine, but I think you've lost your way on this one.  Very disappointed.",1
Comes as promised and she loves it. Makes her forget about all of the other kool stuff I buy for myself.,5
"I really didn't want a renewal and tried to stop it but must have selected the wrong option...it's okay that I have it now, just don't always have the time to keep up with it.",3
"I love the magazine, but there are too many advertisements. I would rather pay more for the magazine to have more articles and less advertisements.",3
Thank you for the heads up on the inappropriate ads for adolescents before I purchased a subscription for my grandson and got into hot water!,1
It just seems like a lot of ads and not much else.  It seems I liked it better when I read it years ago.,3
"Although I purchased Southern Living magazne (which I do love) @ the end of December 2009, it is now the middle of February and I have still yet to receive my 1st issue!",1
My husband loves this magazine. Only complaint keep adding more and more add's,5
How long does it take to update my subscription?  This is taking a very long time to update my subscription.,1
Not much to it anymore.  Not like I remember,3
I've had the print version for 7 months now and have still only received 2 issues. Don't bother with this subscription.,1
This was purchased for a man and he likes it very much so I assume it is a good thing.,4
Still a nice mag but I liked Dog Fancy better and I really miss Dog World.,4
first and last subscription. too pricy,1
best magazine on the market!!,5
So much great information!! Wonderful advice and lots and lots of resources!  Important tool to have!,5
The tote bag sent was not as shown. It was a tiny bag that can barely fit a copy of AD.,1
I want to cancel this for another magazine.  My granddaughter has outgrown this magazine.  It is a great magazine for some younger adults.,1
My da igniters favorite magazine for her 4 & to year old,5
I love this magazine.  Easy to pick up and put down.  Good information that I use and does make lie simpler.  The format is nice and articles are interesting.,5
"I love this magazine.
Great for young housewives. I have used to for 50 years . I learned how to cook and many other household ideas when I was a very young mother.",5
i only received 2 issues!!!(Oct and April) I thought I am going to have an issue for each month...it is nonsense for me...am i misunderstanding the meaning of 1-yr renewal?,1
My favorite Photography magazine. Full of helpful information.,5
The magazine is great. But the clutch was landfill. More like something you'd receive at a nail polish promotion.,3
"Great magazine with really useful, informative articles!",4
"My Mom loves this, and I get her a subscription every year!",5
"The magazine is ok but I don't like the auto-renewal program.
I want to decide for myself not have it automatically billed to me.",3
my 12 year old prefers popular science,4
Would love to subscribe once the online edition has a more reasonable price. Right now I am paying $52 for 1 year and to buy this subscription does not make sense.,1
I love this magazine and have subscribed for years. It is a great western horse mag with lots of wonderful articles and training tips. The Amazon price was really great.,5
Always a wonderful read. Fantastic pictures and you learn something new every time you open it up. Everyone should subscribe at least once then they would be hooked too.,5
"If I could receive the magazine, I'd gladly rate it. I've been waiting close to a month and have yet to get one in the mail.",1
Popular Science is a great magazine at a great price. I read every word of the first issued I received.,5
great deal - great news!!,5
Who doesnt love National Geographic?  Glad I finally subscribed again!,5
"This was a very good price for a very good magazine.  I saved $3 - $5 over

the normal subscription rate!",4
"Will not work with the kindle app, ONLY an actual kindle device. Doesn't seem fair.",1
Renewed magazine for myself which I have been getting for last thirty years.,5
I have been buying it since HS 15 years ago! Love it!!,5
Cancelled it after just one look at it.,1
A few interesting articles I guess.,3
"I bought this for my husband for his birthday, and we both love it! I am very happy with the purchase!",5
After buying item was told would be 3 months before 1st issue.  I won't need it then.  Would never have bought it if I knew I had to wait 3 months,1
Tried a few recipes and they turned out great!,4
"Ripoff!  Will not download, then asks you to subscribe or buy the issue KINDLE UNLIMITED should not list this mag as part of the UNLIMITED  issues.",1
I'm trying to give Woman's Day the benefit of the doubt......too many ads so far...not much reading.  Will have to see what other issues are like.,3
"Magazine is great but not all the on line functions always work. The "" what's on today"" doesn't always scroll through the days!",3
Great humor as always. Grandson loves it.,5
"So full of ads, and poor quality articles and blurbs. Few pages.",1
"I love Oprah, but the magazie seems to be mostly advertisements.  It's not as good as I was hoping",3
Good magazine but it took several months to get the first issue.  They actually sent me renewal notice before we got the first issue.,3
Mit tech review is one of the best glimpses into the future that one can get...excellently researched and written. Awesome!!!,5
wish there was more tattoos to get ideas from,3
I prefer the email newsletter I receive online,3
Works on both seven inch and ten inch tablet (at least for my eyes). Quality of the content varies. Sometimes really great.,4
I like the content but it seems skimpy to me in comparison to the print I used to buy.  I gave it a 3 star because its not as long as the print one I used to buy.,3
Love this magazine.  Lots of beautiful pictures,5
I ordered a subscription for a co-worker as part of our Secret Santa exchange.  She was so excited to get it and has made some of the recipes to share at the office!,5
A wonderful book. Stories are about real people and are true. I have read guidepost for years.,5
I cancelled my subscription.  Google it to find the number. No more cartoons. No more of what I signed up for. What are they thinking?,1
Enjoyed descriptions of places visited. Definitely helps plan trips,4
I have no idea how I ordered this for a whole year. I don't even look at it that much. Do not like it,1
Its not like I remembered.,3
"Got it for my husband who plays the piano and enjoys composing and producing songs on his synthesizer. He loves it, and checks the mail often for the next issue.",5
Delivered as advertised.  VERY Happy!!,5
We always like The Readers Diggest and this was the best deal you could ever find......We are glad we got it......,5
Fantastic edition. Wonderful articles!! A great read,5
Love this magazine and so glad I subscribed again,5
Still one of my fav golf info mags.,4
It is totally Impossible to read Time magazine on my Kindle!!!! I will go to the local news stand and get a paper copy!,1
I used to really love this magazine.  It's been dumb downed and I am not a fan.,1
great magazine i have been reading it for years,5
"No magazine has better recipes than this one. RS makes sure their recipes are delicious, nutritious and easy to follow.
I love this magazine and so does my boyfriend.",5
When and if I get this magazine I will be happy to let you know..,1
Haven't seen anything of it yet. If I had know it would take so long I would have rather bought it from a news stand  or book store,1
Took an awful long time to renew,3
Not very interesting.  It is not worth the money,1
"I guess I'm too old but this magazine was too ""Yuppie"" for me",1
I'm not getting these monthly as I had expected.,2
Best design magazine ever.,5
Impossible to cancel online.  A lot of adds in the magazine. Auto renewed.  Save your money!!!!,1
"With all the focus on being young many trends are just not suitable for the older women.
This magazine is a nice guide line so we look good and not silly.",3
Didn't like magazine.  Too many ads. Not enough interesting content.,2
"I'm in fashion business since 2011, and this magazine is not helping.
You are not getting fashion trends, good pictures of trends, etc.
Just boring long articles...",2
"My 7 and 9 year old girls absolutely love this magazine.  They read it alone, we read it together, and they do the activities.",5
"I always find wonderful, usable, most current health info in this well done publication.
It has become a go to source for me and my family.",5
"I purchased Popular Mechanic through Amazon and cannot open. I contacted PM and they said to cut off my pop ups, I did but did not help, so I paid for absolutely nothing!!",1
Zero stars if I could. Flipped about 25 pages of ads before magazine even started,1
Great magazine with lots of information.,5
