review_text,label
"I do not like the digital version of Newsweek, not a bit.  It is not handy nor enjoyable at all",1
Not the magazines fault but I thought it would be more based upon travel trailer reviews and less about destinations to go visit.,2
I love that I can open a magazine and EAT everything inside it. It's ALL vegetarian!! The recipes are clearly written out and the photos are incredible!,5
Not relevant,1
"Truly enjoyed this issue and the enclosed projects. The information was current and the patterns very well written. Packed full of ideas, concepts and educational articles.",5
People requires you to have the print edition to have the digital edition.  I don't have the print edition so I could never read the digital edition.,1
Been getting it for over 54 years now.,5
Again...not like it was 30-40 years ago!,3
"This was what my niece requested for Christmas, and she was very specific about this magazine. I trust she is pleased.",4
"I have a subscription for the Digest, but for some strange reason, I have yet to receive January 2010.  I am not happy about this.",3
"This is great and an inspiration to me daily, will need to subscribe so i can get the mass included in the publication. thanks so much",5
"you cannot receive it in your pc desk top kindle app. that sucks,you can keep it.",1
"This team is passionate about sharing the stories of Portland, Maine and its wonderful for the region to have a glossy publication representing it.",5
I wasn't too crazy about these magazines. Just didn't keep my interest. too bad.,3
"Ordered 4 magazines, started receiving subscritions within 30 days.  UNBEATABLE price and fantastic Amazon service as always!",5
Great and easy transaction--fast shipping and product arrived in great condition. I would definitely recommend this seller!,5
"I purchased this a month ago and haven't yet received any copies.  Soooo, the only review I can give at this point is their shipping is slow.",1
My first issue turned me off to this publication. It was police propaganda.,1
Came on time and I bought it for my boyfriend who loves them! Was so happy they came on time!,5
Far too many advertisements and a lot of the info pertains to people with rheumatoid arthritis but I have gotten enough out of it to continue to subscribe.,4
I have a problem with the service. We relieved only two magazines In a year time. Where did the other ones go?,1
"The only text that can be enlarged for reading is the adds. The text for the articles is tiny, disappointing.",1
Not working on the 6th generation Kindle Fire HD 8. Please fix.,1
I am not used to reading magazines on my Kindle.  I think I would rather look at it in paper print.,3
"I love this magazine, a little of everything; decorating, recipes, and lots of outdoor garden ideas.
It's an incredible value!",5
"Ok magazine, other home magazines I like better. Good price thru Amazon.",3
"The magazine is good, but I didn't order a subscription.",3
"The Economist's content is and always has been great.  But an electronic edition that costs the same as the print is pure robbery.  Once it drops in price, I will subscribe.",1
"I love all the choices you get with VT.  If you feel like you are always eating the same things over and over, try VT. So many different recipes.  I even enjoy the ads!  Thanks.",5
"The ""new"" Playboy is an abject failure. I might as well subscribe to that lame and boring rag Esquire. At least it is a lot cheaper.",1
MY FAVORITE MAGAZINE!,5
I have only received 2 copies of the Guideposts!!!!!! I thought I would receive one each month!,1
Not enough info. Too much advertising,2
Excellent articles but expensive.  Worth the money in any case.,4
I got this in July and have only got 1.  You suck,1
"Good magazine I enjoy its travel, food, and decorating information. I like Garden and Gun a little better but they are booth great magazines about what is good in the south.",4
I have read Reader's Digest most of my life. Love the short articles and just love this company.,5
This magazine has the best pictures and articles!,5
Love these! Great price!,5
"I did not start getting it yet, taking a long time, hope I start getting it soon, looking for it to start",1
"This is my FAVORITE magazine of all time. Great articles, recipes and the COUPONS rock...pays for itself with the first issue of savings.",5
Won't open on my Kindle. Won't download even after I entered the code. Good luck to anyone else. Subscription ends soon anyways,1
I was quite disappointed with how long it took to process this order - over 2 months.,1
Not as impressed as I thought I was going to be.,3
Always shows up half way through the Grand Slam.  Be nice if it could come prior to !!!!!!!!,1
was unable to get the free copy on kindle after purchesed hard copy and have it mailed to me monthy,1
Have not received verification as to the extending of my subscription. Waiting!,1
love this mag.,5
Love it...so much good information!!,5
Dumbing down & cheapening.,1
Price was right... $5. Print quality and paper quality leaves a lot to be desired.,4
I have found that Kiplinger's is written for the everyday investor better than most other financial magazines I have looked at.,1
I'm assuming our daughter must be enjoying this gift. It began arriving promptly and she seems to be using it.,3
GREAT MAG,4
"Daughter loves this magazine.  Seems to be very appropriate without out all the current social & cultural ""junk.""",4
"I like to read a magazine, and never have time to wait and read the digital version.",4
Pound for pound the best writing in the biz,5
"I love this magazine!!! A hairdresser and my clients love it<3 it's got everything decorating, cooking, organization, fun stuff to do , diet info etc.",5
These issues are getting very thin of late.,3
All ads and not impressed at all with photos or articles. Cancelled the subscription right away. Not worth the money.,1
Great outdoor magazine. Like three predicts they rate and review. Wish there was more stories.,4
Just reading my first issue...finding it to be an good reintroduction to Catholic point of view.,4
I just received my first issue. I am new to the magazine and love it so far.,4
Awesome and insightful. I've already learned so much and have dropped some stock I shouldn't have had.,5
I am so happy I got my first magazine to one year subscription to scale military modeller international thank u very much best magazine for building model tanks,5
"Its really nice just extremely THIN!  If it gets much thinner, it will have to be called a Periodical.",3
Really great mix of ideas and inspiration - but a few too many dress advertisements - would rather see more styling inspiration,4
My husband enjoys this magazine and we have renewed it for another year.,4
"Purchased for 9 year old grandson who loves sports. Loves sports! Loves to play, watch, and read about.",5
I love this magazine !  and this was a great value.,5
I used to like this magazine. It has really changed and not for the better. I have told friends not to buy it any more.,3
I have the same problem as the other customers.  Never received my magazines even after calling them twice. STAY OUT OF THIS SELLER!,1
I have been long familiar with AMERICA magazine. In fact our former pastor occasionally was published therein. However I don't subscribe as a weekly magazine is a bit toomuch,4
"One of my favorite ""dreaming"" magazines",5
I still have not received this item and am very disappointed about that.  It has been almost 2 months.,1
My husband looks forward to receiving every issue.,5
"unlike my other magazine subscriptions, I'm unable to expand the page, unable to read it, plan to cancel.",1
Too bad there's so many advertisements within.  Probably won't order this particular magazine again as there are so many on the market to choose from.  Thanks.,2
Great tips on hunting the latest gossip and where to go. What kind of products for hunting people use and why.,4
I love this magazine but only received 4 issues from my last subscription. How can I be sure this doesn't happen with my new subscription?,1
Some good articles in there.,3
Consistently one of the best mags in the world!,5
"I am filing this in my Projects to Complete file,  detail in articles are easy to follow and end results very good looking.",4
"I ordered this almost two months ago and never received a print copy.
However, the digital copy is good quality.",1
Very helpful,4
great love this mag can't wait for the next  month,5
"Once again a very informative story from a magazine you would not expect to cover such a very technical subject.
Further proof of a magazine well worth haveing.",4
Love D magazine here in Dallas. Looks fine on any coffee table! Great read too and I renew it every year!,5
"Great magazine. But should be named ""national geographic toddler"". Too simple for my 6 y.o. will be great like for 3-4 y.o.",3
Canceled magazine... nothing in it!,1
"For those of you who have a broad view of the world and food, this is the perfect magazine for you; always novel recipes and articles.",5
Best children's magazine available.,5
The paper this is printed on his practically see-through. I don't even think it would work for clip crafts. And most of the information is available on the internet.,3
"Pretty interesting articles, and refreshing broad topics. Biggest complaint is lots of ad's, but then again its good for them as print magazines are struggling.",4
"New date is not on the label of my newest copy  which I just received.
I am unable to verify the renewel.",1
"This give s me lots of ideas to do with my grandkids ,the one thing I wish was more craft ideas.",4
"I've found several great authors and book series through Forever , it's consistently high quality and draws from tons of diverse sources through the years",5
"Good magazine, it gives you lots of tips and ideas.",4
Received 1 magazine of a year's subscription,1
Want to canceled Now... Thank you.,1
"Love the magazine, we are over 60 now, so we like to see things when we were young  keep up the fantastic seditions",5
What can you say about the perfect golf magazine?  My husband loves it.  Perfect gift for him!,5
The papers were delivered 2 dos after publication.  Best to go directly through the publisher and get it delivered same day.,1
I ordered Vanity Fair on May 8th and still have not received the magazine as of 6/09.,1
"Good magazine, nothing spectacular.",3
"As soon as I downloaded this magazine my kindle went slowerer and slowerer. Not to mention,it has a horrible topic. Also I think they read this book in hell",1
I used to get the print version of this magazine and loved every issue (I still have some hanging around).  I really like that I can get this on my kindle now.,4
"A few stories are riceless, most are good and a very few are bombs; overall the mix is enjoyable.  In addition they are just the right lentgth to read in one sitting.",4
This magazine gives a broad range of articles on anything from hunting to fishing to shooting.  Great to have laying around.,5
Great magazine. Provides a lot of ideas. Great inspiration. Next future home is a log home for us.,4
i only received two magazines in a year. it's a theft,1
"I ordered Reader's Digest on-line and requested the  large-print version.  When it arrived, it was the regular small-print version.  I would like to receive what I ordered.",1
I Love all the ideas of home styling it has been a big help when decorating my house. Thank you,5
It is a decent magazine.  Gives guidelines for workouts and eating habits but after a year you're reading the same information just written differently.,3
Love this Magazine! The magazine I get!,5
"I like it because the vaiarity of  subjects and I admire Oprah a lot and the last page  What I know for sure, is my favorit one and what I read it first.",4
We ordered this more than 6 weeks ago and still haven't received it.  I hope it actually comes or I threw $5 out the window.,1
"Very dissatisfied with the copy that I got. Torn, crumpled pages and looks like it has gotten wet. Couldn't even scan the pages properly.",1
Girl friend loves this magazine,5
The magazine is not downloading.,1
My 12 yo loves this!,5
I've yet to receive it. Full cry is a great magazine for anyone that hunts tree dogs its has lots of good information,4
I have been reading paper copy of this magazine  it's full of details and information I recommend this to any political reader,4
Best magazine on the market.,5
"My 14 year old has some special needs, this is a great magazine for him to be able to read and catch up on all of his sports information.",5
"I have not received my first magazine yet, although it has been two months since I ordered.",1
the first Issue was ok I hope the rest are better,3
One of the best publications for knife enthusiast !,5
Never ordered! I hope I wasn't charged!,1
Articles lack real content,1
You literally have to find contents from loads of advertisements.,1
Why don't they just call it the NEW WORLD ORDER magazine.  I cant believe anything in this mag.  Makes me sick.,1
Articles are not that interesting,3
Only got 2 of the magazines,1
My favorite magazine EVER.  Great recipes.  Love the different articles and tips/techniques.,5
The magazine is full of ads.  Not enough substance.  The Free weekender bag looks like it was sewed by a home economics student.  Very cheap!,2
"It has good info.. but it's very basic and things i've already heard.

nothing new found here.",3
So happy to have this subscription!,5
This magazine is one of my favorite subscriptions. Beauty and Fashion tips and tricks for the win.,5
My dad loves this magazine as he was an electrician and loves all things science!,5
"I had hopes for better content for my interest, its a good magazine just not for me and my interest.",2
Each edition has a nude in it.,2
The timeframe for us doesn't work ----- shows from 7 pm to 10 pm; no daytime shows.  But we do like to read the articles and the cheers and jeers.,3
Hard to read on kindle.  Get the paper format if uou want People.,1
Received three issues within a couple of weeks then nothing.,1
It was kind of a turn off this publication leaned to far left a couple of times. I wish they would stick with lifestyle and less with politics.,3
"An excellent magazine for tips, techniques and inspiration in all mediums.  The only thing I don't like is all the advertising.  Too much advertising.",4
"Well I never received the magazine, but I got the tote bag",1
Cant go wrong with this.  If you watch food network get this.,5
I look forward to every issue. The projects are top notch.  I have subscribed to several woodworking magazines.  Popular Woodworking is one of the best.,5
"Based on all the negative comments about Taste of Home, I will not subscribeto the magazine. In the past it was a great read.
Sorry it, too, has gone the 'way of the wind'.",1
Still have not received the magazine? Tracking says High Times will arrive sometime next month? What's up w/that? Should have given that info. When I placed the order.,1
I like the ideas but 70% is advertisements. Just as bad as commercials.,3
"The articles are decent, but the amount of info provided pails in comparison to what u can get with a simple Internet search.",3
Nothing really  iin it,1
Love this magazine.  Always able to find at least one helpful tip in every issue!,5
"Too expensive.  I just retired and I can not afford it any more.
V.S., Congers, NY",1
Do not like the new format.  Was a previous subscriber and like the format of the older magazines better.  Recipes have not been that great in the past couple of issues.,3
Mostly ads now. Disappointed.,2
"Easy to navigate, I enjoy way you can see the entire page but choose to zoom in on a specific article and then scroll to the next.",4
i wish there were zero stars. I only received one magazine since I paid for the subscription. Do not bother with this magazine. They have a lot of negative reviews for a reason!,1
My kids love this magazine! So many interesting facts and the posters are fun.,5
"One of my favorite magazines that was a great deal here on Amazon. I get lots of ideas for organizing, easier methods of cleaning, recipes, and crafts from Good Housekeeping.",5
"Even though some of the stories may be exaggerated, I still enjoy reading about all the celebrity drama. :-) :-)",4
If you are like me there is no such thing as too many decorating magazines.  I have subscribed to this one for years and it is well worth the price.,5
I am very displeased with this.  I tried to cancel my subscription but they would not do so.  I do not want this magazine.,1
"It is not a newsmagazine,just not for me.",1
Not the same magazine you grew up with. Not appropriate in content for children. I cancelled after the first issue arrived,1
My son likes this he doesn't love it. There are a fair amount of ads and it is hard for him to read alone.,3
"It's not that I hate it...on the contrary, I love this magazine...but I don't remember ordering it and never received any copies if I did",1
Our Granddaughter loves this magazine.,5
"Great Magazene to look for ideas, still & decorating rooms!",4
So many places to see and the pictures and recommendations are fantastic! Nat Geo continues it tradition of excellence in the Traveler edition of their magazine! Thanks Nat Geo!!,5
"Like a lot of the features, the layout & beautiful photography. Food features are sometimes have bizarre ingredients.",4
Time has become a political hate magazine; absolute garbage publication......stay clear of this trash and do not let political hate upset your life.,1
This is truly an unexpected Gem.  I found wonderful ideas on how to decorate my home from this magazine.  Really reminds you that a home is more than four walls and lot of stuff.,5
Too much celebraties. I'm not excited about who was where and when. I should have stuck with Vogue. W is a lot more hollywood conscious.,3
love it love it love it.,5
Not what I was looking for.,2
"good magazine, but long time to wait for first issue to arrive - up to 12 weeks",4
I just love IT!,5
great magazine for those who love new england,5
Tablet screens are too small for magazine reading. Please make available for kindle pc.,1
Got this as b-day gift for father-in-law. He loves it! and it is delivered as promised.,5
Love this magazine. Has lots of inspirational ideas for my shabby chic home. Also has lots of shops listed to purchase items for decorating.,5
"I cannot review this item because a month later, I still have not received the first issue of my subscription. Sorry

Frank Calderon",1
I could only down load part of this magazine and noe i want to just cancel it completely,1
"I am sure this will be a great magazine, but I have not received my first issue yet.",1
Only 60% of content successfully downloaded to my Kindle Fire hd tablet! This is not acceptable for a e-subscription!,1
Too long for the subscription to begib,2
nothing rec'd after multiple months,1
I am happy with it.,5
"Sadly they've turned against their readers, and worst of all, with psuedoscience.",1
Greatest birthday gift for my young grandsons!  They love it! Comes every month to their happiness!,5
"really disappointed in the magazine, just like the other on I got ( woman's day ) I should have checked it out first, years ago loved the mag. really disappointed",2
Never able to access the online version.....that was what I wanted....,1
every body know Better Homes is a great magazine. I love it for its gardening ideas and very helpful for where to put flowers and plants.,5
Got this for my mom.  She likes it but over the past year there has been a large increase in the amount of advertisements and a decrease in the qty and length of actual articles,3
"I love readers digest, it is my favorite magazine!  The price was excellent 2 years for $15",5
My favorite magazine looks great in its digital format.,5
The best.,5
CANCEL  MY SUB.....YOU ALL CAN GO TO HE DOUBLE L.,1
Love this magazine and the recipes are great also.,5
Great waiting for more,5
really boring articles,2
"good mag. nice articles and enjoy seeing the new things that are coming out.
nice articles on long term test of new cars",4
"This is a great way to lose those extra pounds, while having fun. Keeping your mind busy planning the trip,getting there;and your every move along the trail.",5
I absolutely love this magazine I read it cover-to-cover it is so informative and spirit-lifting,5
Love this magazine-always have. I look forward to receiving it every week in the mailbox and of course the year end special.,5
".. I discovered the Economist and understood what a real in depth weekly news magazine could be.  Sadly, Time does not really fit the bill anymore for me.",3
Not that interesting . Not really worth it. Try nylon instead,1
"Subscribed through Amazon for one year from July 2014 to July 2015. Got automatically renewed in April 2015 without notice, three months before it is supposed to renew.",1
I only received 3 magazine in total. I thought I'd get a magazine once a month. I will feel very disappointed with this subscription and will not renew.,1
Download uneven. 24 hours later content I still downloading.,1
"I only received 1 magazine when I had a year subscription from 01/04/2013 to 01/04/2014.  Don't buy this magazine, they will take your money but not deliver the product.",1
One of my favorite mags....,5
Grandson Loves it. I'm going to have to get it for my other grand children.,5
"Not as many recipes as I expected, but there were a few good vegetarian recipes.  First issue I received was geared a bit too much toward Vegan.",3
"Great magazine. Full of fantastic articles, delicious recipes and helpful advice. Magazine began arriving to my home within 2 weeks of ordering.",5
"If you want one sided biased reports that excludes much of what they preach, this is the magazine for you.",1
Watch out! They auto renew you and it's a pain to get it stopped!,1
Wish there were more every day recipes and less articles.,4
Digital edition doesn't work!,1
Comes in hand to see what's available,4
I order this magazine for my husband. He is very into cars. THis magazine is a great magazine to learn more about cars. This magazine is perfect for any one who like cars,4
Way too  many  add's ..,2
"what can i say, it's a motorcycle consumer new mad....good info",4
"Would like to see more printing materials and less photos and add.
Also more info regarding  vintage  watches  and results  of rare watches auctioned",3
Mostly Ads.  Not a very interesting magazine.  I will not renew.,2
Wonderful magazine!!!,5
"Got one magazine
And I got a last magazine notice 2 days later
Weird
If its true its a BAD DEAL!",1
"Auto renewal for magazines is a bad idea, because Amazon does not tell you what price they are renewed at.",1
perfect reading material,3
Love this magazine...thanks.,5
"Clearly, a magazine that would give credence to a liar, fraud, and ""organic"" shill like Vani Hari, is not a magazine that aims to bring any truth or knowledge to its readers.",1
"Horrifically useless.

Tried to return, and Amazon's site wouldn't take my email.  Ripoff.",1
Meh. It's okay.,3
"It's okay. Light on articles and heavy on advertising. Read my first issue, cover to cover, in about 35 minutes.",3
daughter who loves history enjoys this magazine,5
Us Weekly cannot go a week without a Kardashian on the cover.  I am sick of hearing about this family.  I didn't renew my subscription.,1
I thought I was getting a printed copy of the magazine.....,1
I get this magazine for myself and my daughter.  We both love it.,5
this is a great magazine i just love rachael ray and she has alot of recipes am very happy to be getting it every month,5
Love this magazine and great price.,5
Not very interesting,2
This is a great magazine-I purchased it as a gift for my mom and she loves it!,5
I love how many recipes come in the magazine.,5
very inappropriate for a child .  canceled mine tonight . I would give it a minus one if i could . Gay issues should not be in children's magazines .,1
Great magazine with great pictures and ideas!,4
"Its okay, but not much content - mostly what was worn where by whom.  Not so much as ""what happened.""  Who did what.",3
I look forward to seeing this magazine everytime it arrives. My wife reads it also cover to cover,5
"I have subsribed to all the r/c mags for some time.

This mag has become a glorified catalog for the adertizers.

it used to be a real good mag once.",4
It's a good mag but nothing like it was in the past.,3
Too many damn recipes kind of boring,3
This would have been a great purchase because of the cost. Just over a month now and I have yet to see an actual issue be delivered.,1
I have been buying this magazine for my son-in-law for a few years now.  He loves getting it and refuses to throw any away.,5
Smaller magazine than othe running magazines but really good stories in it that I find myself reading instead of skimming,4
"I received a letter telling me that they were not publishing the magazine anymore, and replaced it with Glamour, so no, not happy.",1
love the mag. don't like being ask to subscribe on the first issue.,4
"Excellent magazine
Starting using the recipes as soon as I got it.
Fun to read and try all the ideas of cooking!!!!",5
I enjoyed the stories but was hoping for more focus around entrepreneurship and discussion around market trends.,3
Too long for the subscription to stRt,2
I did not request or want to renew.  You just did it on your own.  I should not have to pay for it,1
My daughter just loves it!  Highly recommend to horse lovers!,5
took a while to begin receiving at my dad's.  watch the end date - they automatically renew unless you tell them not to.,3
